{
  "version": 1,
  "id": "pelora-control-documentation-check",
  "owner": "PELORA-CONTROL",
  "title": "Review canonical control-plane governance routing",
  "goal": "Read AGENTS.md and the canonical release routing at the pinned baseline; report the required task and approval boundaries using repository references only. This example is not queued or assigned.",
  "baseline": "10150d5a8187e4ba52f62c0c747d919b30345b7d",
  "repository": "ChartIntelligence/SmartCharts-Offshore-Intelligence",
  "worktree": "pelora-control-documentation-check",
  "branch": "codex/pelora-control-documentation-check",
  "environment": "local",
  "dependencies": [],
  "allowedFiles": [],
  "protectedFiles": ["AGENTS.md"],
  "protectedContracts": [],
  "governance": ["product", "science", "privacy", "release", "beta", "decisions", "ownership"],
  "type": "analysis",
  "permittedActions": ["read", "worktree"],
  "blockedActions": ["write", "commit", "push", "merge", "production-deploy", "production-migration", "production-schema", "production-grants", "production-rls", "credentials", "secrets", "paid-services", "system-install", "elevation", "render-production", "supabase-production", "locked-governance-change", "beta-ready", "launch-ready"],
  "requiredTests": [],
  "commitPolicy": "forbid",
  "pushPolicy": "forbid",
  "mergePolicy": "forbid",
  "approvalRequirements": [],
  "stopConditions": ["Governance conflict", "Unexpected worktree identity", "Private/secret evidence or sensitive action needed"],
  "expectedDisposition": "COMPLETE"
}
